DBN,SCHOOL NAME,Num of SAT Test Takers,SAT Critical Reading Avg. Score,SAT Math Avg. Score,SAT Writing Avg. Score,SAT Overall Avg
01M292,HENRY STREET SCHOOL FOR INTERNATIONAL STUDIES,29,355,404,363,374.0
01M448,UNIVERSITY NEIGHBORHOOD HIGH SCHOOL,91,383,423,366,390.7
01M450,EAST SIDE COMMUNITY SCHOOL,70,377,402,370,383.0
01M458,FORSYTH SATELLITE ACADEMY,7,414,401,359,391.3
01M509,MARTA VALLE HIGH SCHOOL,44,390,433,384,402.3
01M515,LOWER EAST SIDE PREPARATORY HIGH SCHOOL,112,332,557,316,401.7
01M539,"NEW EXPLORATIONS INTO SCIENCE, TECHNOLOGY AND MATH HIGH SCHOOL",159,522,574,525,540.3
01M650,CASCADES HIGH SCHOOL,18,417,418,411,415.3
01M696,BARD HIGH SCHOOL EARLY COLLEGE,130,624,604,628,618.7
02M047,47 THE AMERICAN SIGN LANGUAGE AND ENGLISH SECONDARY SCHOOL,16,395,400,387,394.0
02M288,FOOD AND FINANCE HIGH SCHOOL,62,409,393,392,398.0
02M294,ESSEX STREET ACADEMY,53,394,384,378,385.3
02M296,HIGH SCHOOL OF HOSPITALITY MANAGEMENT,58,374,375,362,370.3
02M298,PACE HIGH SCHOOL,85,423,438,432,431.0
02M300,"URBAN ASSEMBLY SCHOOL OF DESIGN AND CONSTRUCTION, THE",48,404,449,416,423.0
02M303,"FACING HISTORY SCHOOL, THE",76,353,358,340,350.3
02M305,"URBAN ASSEMBLY ACADEMY OF GOVERNMENT AND LAW, THE",50,375,388,385,382.7
02M308,LOWER MANHATTAN ARTS ACADEMY,40,403,392,405,400.0
02M313,"JAMES BALDWIN SCHOOL, THE: A SCHOOL FOR EXPEDITIONARY LEARNING",69,408,390,390,396.0
02M316,"URBAN ASSEMBLY SCHOOL OF BUSINESS FOR YOUNG WOMEN, THE",42,373,370,384,375.7
02M374,GRAMERCY ARTS HIGH SCHOOL,60,391,391,394,392.0
02M376,NYC ISCHOOL,92,473,483,479,478.3
02M392,MANHATTAN BUSINESS ACADEMY,,,,,#DIV/0!
02M393,BUSINESS OF SPORTS SCHOOL,,,,,#DIV/0!
02M394,EMMA LAZARUS HIGH SCHOOL,79,319,512,357,396.0
02M399,THE HIGH SCHOOL FOR LANGUAGE AND DIPLOMACY,,,,,#DIV/0!
02M400,HIGH SCHOOL FOR ENVIRONMENTAL STUDIES,263,465,493,461,473.0
02M407,INSTITUTE FOR COLLABORATIVE EDUCATION,54,492,465,467,474.7
02M408,PROFESSIONAL PERFORMING ARTS HIGH SCHOOL,94,509,490,523,507.3
02M411,BARUCH COLLEGE CAMPUS HIGH SCHOOL,104,496,563,518,525.7
02M412,N.Y.C. LAB SCHOOL FOR COLLABORATIVE STUDIES,114,537,590,550,559.0
02M413,SCHOOL OF THE FUTURE HIGH SCHOOL,66,517,533,515,521.7
02M414,N.Y.C. MUSEUM SCHOOL,103,468,492,459,473.0
02M416,ELEANOR ROOSEVELT HIGH SCHOOL,127,572,594,592,586.0
02M418,MILLENNIUM HIGH SCHOOL,144,528,553,533,538.0
02M419,LANDMARK HIGH SCHOOL,62,390,399,381,390.0
02M420,HIGH SCHOOL FOR HEALTH PROFESSIONS AND HUMAN SERVICES,336,429,449,428,435.3
02M425,LEADERSHIP AND PUBLIC SERVICE HIGH SCHOOL,84,416,426,391,411.0
02M427,MANHATTAN ACADEMY FOR ARTS & LANGUAGE,,,,,#DIV/0!
02M429,LEGACY SCHOOL FOR INTEGRATED STUDIES,29,356,357,349,354.0
02M437,HUDSON HIGH SCHOOL OF LEARNING TECHNOLOGIES,,,,,#DIV/0!
02M438,INTERNATIONAL HIGH SCHOOL AT UNION SQUARE,,,,,#DIV/0!
02M439,MANHATTAN VILLAGE ACADEMY,95,441,473,458,457.3
02M440,BAYARD RUSTIN EDUCATIONAL COMPLEX,59,378,365,368,370.3
02M449,VANGUARD HIGH SCHOOL,72,395,416,388,399.7
02M459,MANHATTAN INTERNATIONAL HIGH SCHOOL,49,376,460,391,409.0
02M460,WASHINGTON IRVING HIGH SCHOOL,151,373,387,360,373.3
02M473,WASHINGTON IRVING YABC,,,,,#DIV/0!
02M475,STUYVESANT HIGH SCHOOL,832,679,735,682,698.7
02M489,HIGH SCHOOL OF ECONOMICS AND FINANCE,167,443,489,442,458.0
02M500,UNITY CENTER FOR URBAN TECHNOLOGIES,25,370,349,351,356.7
02M519,TALENT UNLIMITED HIGH SCHOOL,81,469,472,475,472.0
02M520,MURRY BERGTRAUM HIGH SCHOOL FOR BUSINESS CAREERS,264,407,440,393,413.3
02M529,JACQUELINE KENNEDY ONASSIS HIGH SCHOOL,131,414,425,400,413.0
02M531,REPERTORY COMPANY HIGH SCHOOL FOR THEATRE ARTS,42,429,404,420,417.7
02M542,MANHATTAN BRIDGES HIGH SCHOOL,66,336,378,344,352.7
02M543,NEW DESIGN HIGH SCHOOL,73,391,395,382,389.3
02M544,INDEPENDENCE HIGH SCHOOL,14,389,371,335,365.0
02M545,HIGH SCHOOL FOR DUAL LANGUAGE AND ASIAN STUDIES,78,412,581,431,474.7
02M550,LIBERTY HIGH SCHOOL ACADEMY FOR NEWCOMERS,26,368,436,352,385.3
02M551,THE URBAN ASSEMBLY NEW YORK HARBOR SCHOOL,77,405,423,384,404.0
02M560,HIGH SCHOOL M560 s CITY AS SCHOOL,56,498,440,477,471.7
02M565,URBAN ACADEMY LABORATORY HIGH SCHOOL,30,527,508,512,515.7
02M570,SATELLITE ACADEMY HIGH SCHOOL,33,350,337,345,344.0
02M575,MANHATTAN COMPREHENSIVE NIGHT AND DAY HIGH SCHOOL,121,345,517,343,401.7
02M580,RICHARD R. GREEN HIGH SCHOOL OF TEACHING,84,408,384,403,398.3
02M586,HARVEY MILK HIGH SCHOOL,9,458,416,429,434.3
02M600,THE HIGH SCHOOL OF FASHION INDUSTRIES,335,423,423,411,419.0
02M605,HUMANITIES PREPARATORY ACADEMY,36,426,403,426,418.3
02M615,CHELSEA CAREER AND TECHNICAL EDUCATION HIGH SCHOOL,83,399,418,390,402.3
02M620,NORMAN THOMAS HIGH SCHOOL,154,370,379,359,369.3
02M625,HIGH SCHOOL OF GRAPHIC COMMUNICATION ARTS,191,395,382,376,384.3
02M630,ART AND DESIGN HIGH SCHOOL,270,444,441,430,438.3
02M655,LIFE SCIENCES SECONDARY SCHOOL,61,409,424,403,412.0
03M283,MANHATTAN THEATRE LAB HIGH SCHOOL,27,406,379,408,397.7
03M299,"HIGH SCHOOL FOR ARTS, IMAGINATION AND INQUIRY",49,374,384,374,377.3
03M307,"URBAN ASSEMBLY SCHOOL FOR MEDIA STUDIES, THE",41,384,390,370,381.3
03M402,THE URBAN ASSEMBLY SCHOOL FOR GREEN CAREERS,,,,,#DIV/0!
03M403,THE GLOBAL LEARNING COLLABORATIVE,,,,,#DIV/0!
03M404,INNOVATION DIPLOMA PLUS,12,416,403,381,400.0
03M415,WADLEIGH SECONDARY SCHOOL FOR THE PERFORMING & VISUAL ARTS,32,371,368,370,369.7
03M417,FRANK MCCOURT HIGH SCHOOL,,,,,#DIV/0!
03M470,LOUIS D. BRANDEIS HIGH SCHOOL,131,370,390,358,372.7
03M479,BEACON HIGH SCHOOL,261,577,575,592,581.3
03M485,FIORELLO H. LAGUARDIA HIGH SCHOOL OF MUSIC & ART AND PERFORMING ARTS,531,566,564,577,569.0
03M492,"HIGH SCHOOL FOR LAW, ADVOCACY AND COMMUNITY JUSTICE",66,396,398,402,398.7
03M494,HIGH SCHOOL OF ARTS AND TECHNOLOGY,75,433,433,411,425.7
03M505,EDWARD A. REYNOLDS WEST SIDE HIGH SCHOOL,35,401,369,351,373.7
03M541,MANHATTAN / HUNTER SCIENCE HIGH SCHOOL,111,473,506,467,482.0
03M577,YOUNG ADULT BOROUGH CENTER AT LOUIS D. BRANDEIS HS,,,,,#DIV/0!
03M860,FREDERICK DOUGLASS ACADEMY II SECONDARY SCHOOL,43,356,379,361,365.3
04M409,COALITION SCHOOL FOR SOCIAL CHANGE,48,354,357,373,361.3
04M435,MANHATTAN CENTER FOR SCIENCE AND MATHEMATICS,375,461,514,455,476.7
04M495,PARK EAST HIGH SCHOOL,51,373,379,376,376.0
04M555,CENTRAL PARK EAST HIGH SCHOOL,73,405,421,395,407.0
04M610,YOUNG WOMEN'S LEADERSHIP SCHOOL,70,432,446,448,442.0
04M635,ACADEMY OF ENVIRONMENTAL SCIENCE SECONDARY HIGH SCHOOL,48,369,369,357,365.0
04M680,"HERITAGE SCHOOL, THE",31,358,351,345,351.3
05M285,HARLEM RENAISSANCE HIGH SCHOOL,29,357,318,333,336.0
05M304,MOTT HALL HIGH SCHOOL,54,413,399,398,403.3
05M362,"COLUMBIA SECONDARY SCHOOL FOR MATH, SCIENCE, AND ENGINEERING",,,,,#DIV/0!
05M367,ACADEMY FOR SOCIAL ACTION: A COLLEGE BOARD SCHOOL,33,354,366,342,354.0
05M369,URBAN ASSEMBLY SCHOOL FOR THE PERFORMING ARTS,56,360,353,364,359.0
05M469,CHOIR ACADEMY OF HARLEM,20,354,360,385,366.3
05M499,FREDERICK DOUGLASS ACADEMY,214,458,474,442,458.0
05M670,THURGOOD MARSHALL ACADEMY FOR LEARNING AND SOCIAL CHANGE,66,396,402,404,400.7
05M685,BREAD & ROSES INTEGRATED ARTS HIGH SCHOOL,61,369,361,355,361.7
05M692,"HIGH SCHOOL FOR MATHEMATICS, SCIENCE AND ENGINEERING AT CITY COLLEGE",101,605,654,588,615.7
06M293,CITY COLLEGE ACADEMY OF THE ARTS,60,408,446,416,423.3
06M346,COMMUNITY HEALTH ACADEMY OF THE HEIGHTS,55,362,376,367,368.3
06M348,WASHINGTON HEIGHTS EXPEDITIONARY LEARNING SCHOOL,70,380,395,399,391.3
06M423,HIGH SCHOOL FOR EXCELLENCE AND INNOVATION,,,,,#DIV/0!
06M457,GEORGE WASHINGTON YABC,7,394,357,346,365.7
06M462,HIGH SCHOOL FOR INTERNATIONAL BUSINESS AND FINANCE,76,365,384,378,375.7
06M463,HIGH SCHOOL FOR MEDIA AND COMMUNICATIONS,63,369,380,349,366.0
06M467,HIGH SCHOOL FOR LAW AND PUBLIC SERVICE,94,363,378,361,367.3
06M468,HIGH SCHOOL FOR HEALTH CAREERS AND SCIENCES,24,400,422,402,408.0
06M540,A. PHILIP RANDOLPH CAMPUS HIGH SCHOOL,228,430,456,423,436.3
06M552,GREGORIO LUPERON HIGH SCHOOL FOR SCIENCE AND MATHEMATICS,56,339,349,326,338.0
07X221,SOUTH BRONX PREPARATORY: A COLLEGE BOARD SCHOOL,65,364,378,348,363.3
07X321,CROTONA ACADEMY HIGH SCHOOL,9,379,364,382,375.0
07X334,INTERNATIONAL COMMUNITY HIGH SCHOOL,34,310,324,311,315.0
07X379,JILL CHAIFETZ TRANSFER HIGH SCHOOL,,,,,#DIV/0!
07X381,BRONX HAVEN HIGH SCHOOL,,,,,#DIV/0!
07X427,COMMUNITY SCHOOL FOR SOCIAL JUSTICE,43,361,359,357,359.0
07X473,MOTT HAVEN VILLAGE PREPARATORY HIGH SCHOOL,63,351,375,371,365.7
07X495,UNIVERSITY HEIGHTS SECONDARY SCHOOL,79,403,394,404,400.3
07X500,HOSTOSsLINCOLN ACADEMY OF SCIENCE,66,420,426,411,419.0
07X520,FOREIGN LANGUAGE ACADEMY OF GLOBAL STUDIES,64,399,396,391,395.3
07X527,BRONX LEADERSHIP ACADEMY II HIGH SCHOOL,62,362,378,363,367.7
07X547,NEW EXPLORERS HIGH SCHOOL,28,367,356,361,361.3
07X548,URBAN ASSEMBLY SCHOOL FOR CAREERS IN SPORTS,44,387,411,383,393.7
07X551,BRONX ACADEMY OF LETTERS,51,413,381,407,400.3
07X600,ALFRED E. SMITH CAREER AND TECHNICAL EDUCATION HIGH SCHOOL,76,394,400,364,386.0
07X655,SAMUEL GOMPERS CAREER AND TECHNICAL EDUCATION HIGH SCHOOL,47,398,416,370,394.7
07X670,HEALTH OPPORTUNITIES HIGH SCHOOL,114,363,368,364,365.0
08X269,BRONX STUDIO SCHOOL FOR WRITERS AND ARTISTS,,,,,#DIV/0!
08X282,WOMEN'S ACADEMY OF EXCELLENCE,44,407,386,378,390.3
08X293,RENAISSANCE HIGH SCHOOL FOR MUSICAL THEATER & TECHNOLOGY,52,384,385,389,386.0
08X295,GATEWAY SCHOOL FOR ENVIRONMENTAL RESEARCH AND TECHNOLOGY,41,416,390,394,400.0
08X305,PABLO NERUDA ACADEMY FOR ARCHITECTURE AND WORLD STUDIES,67,337,361,340,346.0
08X312,MILLENNIUM ART ACADEMY,67,387,402,375,388.0
08X332,HOLCOMBE L. RUCKER SCHOOL OF COMMUNITY RESEARCH,39,363,371,350,361.3
08X367,"ARCHIMEDES ACADEMY FOR MATH, SCIENCE AND TECHNOLOGY APPLICATIONS",,,,,#DIV/0!
08X376,"ANTONIA PANTOJA PREPARATORY ACADEMY, A COLLEGE BOARD SCHOOL",,,,,#DIV/0!
08X377,BRONX COMMUNITY HIGH SCHOOL,9,367,369,376,370.7
08X405,HERBERT H. LEHMAN HIGH SCHOOL,415,412,436,393,413.7
08X408,HERBERT H. LEHMAN YABC,6,402,373,413,396.0
08X432,BRONX BRIDGES HIGH SCHOOL,,,,,#DIV/0!
08X452,BRONX GUILD,39,369,371,365,368.3
08X507,STEVENSON YABC,,,,,#DIV/0!
08X519,"FELISA RINCON DE GAUTIER INSTITUTE FOR LAW AND PUBLIC POLICY, THE",68,373,370,356,366.3
08X530,BANANA KELLY HIGH SCHOOL,54,373,381,377,377.0
08X537,BRONX ARENA HIGH SCHOOL,,,,,#DIV/0!
08X540,SCHOOL FOR COMMUNITY RESEARCH AND LEARNING,16,366,400,368,378.0
08X560,HIGH SCHOOL X560 s BRONX ACADEMY HIGH SCHOOL,9,404,368,399,390.3
08X650,JANE ADDAMS HIGH SCHOOL FOR ACADEMIC CAREERS,78,377,359,376,370.7
09X227,BRONX EXPEDITIONARY LEARNING HIGH SCHOOL,39,324,376,349,349.7
09X231,EAGLE ACADEMY FOR YOUNG MEN,78,373,387,374,378.0
09X239,"URBAN ASSEMBLY ACADEMY FOR HISTORY AND CITIZENSHIP FOR YOUNG MEN, THE",33,372,355,357,361.3
09X241,"URBAN ASSEMBLY SCHOOL FOR APPLIED MATH AND SCIENCE, THE",80,411,464,415,430.0
09X250,EXIMIUS COLLEGE PREPARATORY ACADEMY: A COLLEGE BOARD SCHOOL,50,393,394,382,389.7
09X252,MOTT HALL BRONX HIGH SCHOOL,67,369,367,356,364.0
09X260,BRONX CENTER FOR SCIENCE AND MATHEMATICS,81,459,480,457,465.3
09X263,VALIDUS PREPARATORY ACADEMY: AN EXPEDITIONARY LEARNING SCHOOL,74,356,363,356,358.3
09X276,LEADERSHIP INSTITUTE,30,361,353,367,360.3
09X297,MORRIS ACADEMY FOR COLLABORATIVE STUDIES,38,386,386,376,382.7
09X324,BRONX EARLY COLLEGE ACADEMY FOR TEACHING & LEARNING,,,,,#DIV/0!
09X329,DREAMYARD PREPARATORY SCHOOL,51,382,365,391,379.3
09X365,ACADEMY FOR LANGUAGE AND TECHNOLOGY,54,315,339,297,317.0
09X403,BRONX INTERNATIONAL HIGH SCHOOL,49,314,312,339,321.7
09X404,SCHOOL FOR EXCELLENCE,32,363,360,351,358.0
09X412,BRONX HIGH SCHOOL OF BUSINESS,34,356,376,351,361.0
09X413,BRONX HIGH SCHOOL FOR MEDICAL SCIENCE,64,400,419,402,407.0
09X414,JONATHAN LEVIN HIGH SCHOOL FOR MEDIA AND COMMUNICATIONS,35,379,364,379,374.0
09X505,"BRONX SCHOOL FOR LAW, GOVERNMENT AND JUSTICE",80,404,418,402,408.0
09X517,FREDERICK DOUGLASS ACADEMY III SECONDARY SCHOOL,50,368,384,369,373.7
09X525,BRONX LEADERSHIP ACADEMY HIGH SCHOOL,114,384,394,388,388.7
09X543,HIGH SCHOOL FOR VIOLIN AND DANCE,27,353,315,371,346.3
10X141,RIVERDALE / KINGSBRIDGE ACADEMY (MIDDLE SCHOOL / HIGH SCHOOL 141),113,438,455,440,444.3
10X213,BRONX ENGINEERING AND TECHNOLOGY ACADEMY,86,373,412,365,383.3
10X225,THEATRE ARTS PRODUCTION COMPANY SCHOOL,59,405,391,394,396.7
10X237,"THE MARIE CURIE SCHOOL FOR MEDICINE, NURSING, AND HEALTH PROFESSIONS",79,382,393,382,385.7
10X243,WEST BRONX ACADEMY FOR THE FUTURE,26,382,406,370,386.0
10X268,KINGSBRIDGE INTERNATIONAL HIGH SCHOOL,52,304,356,302,320.7
10X284,BRONX SCHOOL OF LAW AND FINANCE,54,402,395,385,394.0
10X319,PROVIDING URBAN LEARNERS SUCCESS IN EDUCATION HIGH SCHOOL,,,,,#DIV/0!
10X342,INTERNATIONAL SCHOOL FOR LIBERAL ARTS,49,300,333,301,311.3
10X368,INsTECH ACADEMY (M.S. / HIGH SCHOOL 368),111,390,408,383,393.7
10X374,KNOWLEDGE AND POWER PREPARATORY ACADEMY INTERNATIONAL HIGH SCHOOL (KAPPA),61,392,401,387,393.3
10X397,ENGLISH LANGUAGE LEARNERS AND INTERNATIONAL SUPPORT PREPARATORY ACADEMY (ELLIS),38,343,356,330,343.0
10X433,HIGH SCHOOL FOR TEACHING AND THE PROFESSIONS,57,370,371,365,368.7
10X434,BELMONT PREPARATORY HIGH SCHOOL,51,404,418,400,407.3
10X437,FORDHAM HIGH SCHOOL FOR THE ARTS,48,355,350,372,359.0
10X438,FORDHAM LEADERSHIP ACADEMY FOR BUSINESS AND TECHNOLOGY,63,367,385,367,373.0
10X439,BRONX HIGH SCHOOL FOR LAW AND COMMUNITY SERVICE,65,366,364,352,360.7
10X440,DEWITT CLINTON HIGH SCHOOL,443,419,426,410,418.3
10X442,"CELIA CRUZ BRONX HIGH SCHOOL OF MUSIC, THE",52,423,420,427,423.3
10X445,BRONX HIGH SCHOOL OF SCIENCE,731,632,688,649,656.3
10X475,JOHN F. KENNEDY HIGH SCHOOL,109,351,362,339,350.7
10X477,MARBLE HILL HIGH SCHOOL FOR INTERNATIONAL STUDIES,99,414,435,414,421.0
10X478,LEARNING TO WORK GED AT JOHN F. KENNEDY,,,,,#DIV/0!
10X546,BRONX THEATRE HIGH SCHOOL,68,348,362,354,354.7
10X549,DISCOVERY HIGH SCHOOL,55,372,379,364,371.7
10X660,GRACE DODGE CAREER AND TECHNICAL EDUCATION HIGH SCHOOL,73,362,382,356,366.7
10X667,GRACE DODGE YABC,10,350,356,317,341.0
10X696,HIGH SCHOOL OF AMERICAN STUDIES AT LEHMAN COLLEGE,92,636,648,636,640.0
11X249,BRONX HEALTH SCIENCES HIGH SCHOOL,74,370,381,382,377.7
11X253,BRONX HIGH SCHOOL FOR WRITING AND COMMUNICATION ARTS,46,400,357,390,382.3
11X265,BRONX LAB SCHOOL,81,377,391,367,378.3
11X270,ACADEMY FOR SCHOLARSHIP AND ENTREPRENEURSHIP: A COLLEGE BOARD SCHOOL,56,386,394,361,380.3
11X275,HIGH SCHOOL OF COMPUTERS AND TECHNOLOGY,72,381,376,354,370.3
11X288,COLLEGIATE INSTITUTE FOR MATH AND SCIENCE,97,444,471,433,449.3
11X290,BRONX ACADEMY OF HEALTH CAREERS,69,387,365,383,378.3
11X299,ASTOR COLLEGIATE ACADEMY,60,387,391,391,389.7
11X415,CHRISTOPHER COLUMBUS HIGH SCHOOL,121,367,361,353,360.3
11X417,YOUNG ADULT BOROUGH CNTR CHRISTOPHER COLUMBUS HS,,,,,#DIV/0!
11X418,BRONX HIGH SCHOOL FOR THE VISUAL ARTS,48,419,433,416,422.7
11X455,HARRY S TRUMAN HIGH SCHOOL,189,386,397,368,383.7
11X456,LEARNING TO WORK YABC AT TRUMAN HIGH SCHOOL,,,,,#DIV/0!
11X513,NEW WORLD HIGH SCHOOL,72,332,381,335,349.3
11X514,THE BRONXWOOD PREPARATORY ACADEMY,48,377,372,363,370.7
11X541,GLOBAL ENTERPRISE HIGH SCHOOL,57,372,382,375,376.3
11X542,PELHAM PREPARATORY ACADEMY,76,431,438,419,429.3
11X544,HIGH SCHOOL FOR CONTEMPORARY ARTS,55,383,378,365,375.3
11X545,BRONX AEROSPACE HIGH SCHOOL,46,388,393,382,387.7
12X245,NEW DAY ACADEMY,25,348,344,354,348.7
12X248,"METROPOLITAN HIGH SCHOOL, THE",49,347,367,341,351.7
12X251,EXPLORATIONS ACADEMY,57,381,381,360,374.0
12X262,PERFORMANCE CONSERVATORY HIGH SCHOOL,30,361,353,360,358.0
12X267,BRONX LATIN,36,408,432,411,417.0
12X271,EAST BRONX ACADEMY FOR THE FUTURE,46,366,378,358,367.3
12X278,PEACE AND DIVERSITY ACADEMY,34,390,401,364,385.0
12X388,PAN AMERICAN INTERNATIONAL HIGH SCHOOL AT MONROE,30,321,351,298,323.3
12X428,LEARNING TO WORK YABC AT MONROE ACADEMY,,,,,#DIV/0!
12X446,ARTURO A. SCHOMBURG SATELLITE ACADEMY BRONX,14,380,372,349,367.0
12X478,THE CINEMA SCHOOL,,,,,#DIV/0!
12X479,BRONX CAREER AND COLLEGE PREPARATORY HIGH SCHOOL,,,,,#DIV/0!
12X480,BRONX REGIONAL HIGH SCHOOL,16,398,385,398,393.7
12X550,HIGH SCHOOL OF WORLD CULTURES,42,304,323,312,313.0
12X682,FANNIE LOU HAMER FREEDOM HIGH SCHOOL,72,342,346,341,343.0
12X684,WINGS ACADEMY,66,378,374,362,371.3
12X690,MONROE ACADEMY FOR BUSINESS/LAW,31,375,387,376,379.3
12X692,MONROE ACADEMY FOR VISUAL ARTS & DESIGN,43,332,357,349,346.0
13K265,DR. SUSAN S. MCKINNEY SECONDARY SCHOOL OF THE ARTS,29,352,349,373,358.0
13K336,ACADEMY OF BUSINESS AND COMMUNITY DEVELOPMENT,9,439,374,418,410.3
13K350,URBAN ASSEMBLY HIGH SCHOOL OF MUSIC AND ART,52,360,364,356,360.0
13K412,"BROOKLYN COMMUNITY HIGH SCHOOL OF COMMUNICATION, ARTS AND MEDIA",37,375,355,384,371.3
13K419,"SCIENCE SKILLS CENTER HIGH SCHOOL FOR SCIENCE, TECHNOLOGY AND THE CREATIVE ARTS",92,399,417,395,403.7
13K430,BROOKLYN TECHNICAL HIGH SCHOOL,1277,587,659,587,611.0
13K439,BROOKLYN INTERNATIONAL HIGH SCHOOL,90,305,364,312,327.0
13K483,THE URBAN ASSEMBLY SCHOOL FOR LAW AND JUSTICE,105,400,417,389,402.0
13K499,ACORN COMMUNITY HIGH SCHOOL,72,384,364,368,372.0
13K509,FREEDOM ACADEMY HIGH SCHOOL,29,400,390,403,397.7
13K527,URBAN ASSEMBLY INSTITUTE OF MATH AND SCIENCE FOR YOUNG WOMEN,,,,,#DIV/0!
13K553,BROOKLYN ACADEMY HIGH SCHOOL,8,435,383,379,399.0
13K575,BEDFORD STUYVESANT PREPARATORY HIGH SCHOOL,13,398,391,394,394.3
13K595,BEDFORD ACADEMY HIGH SCHOOL,89,438,443,431,437.3
13K605,GEORGE WESTINGHOUSE CAREER AND TECHNICAL EDUCATION HIGH SCHOOL,85,406,391,392,396.3
13K616,BROOKLYN HIGH SCHOOL FOR LEADERSHIP AND COMMUNITY SERVICE,,,,,#DIV/0!
13K670,BENJAMIN BANNEKER ACADEMY,185,471,472,448,463.7
13K674,"CITY POLYTECHNIC HIGH SCHOOL OF ENGINEERING, ARCHITECTURE, AND TECHNOLOGY",20,441,499,413,451.0
14K071,JUAN MOREL CAMPOS SECONDARY SCHOOL,102,365,361,359,361.7
14K322,FOUNDATIONS ACADEMY,,,,,#DIV/0!
14K404,ACADEMY FOR YOUNG WRITERS,68,387,357,381,375.0
14K449,"BROOKLYN LATIN SCHOOL, THE",72,586,584,570,580.0
14K454,GREEN SCHOOL: AN ACADEMY FOR ENVIRONMENTAL CAREERS,41,407,386,396,396.3
14K474,PROGRESS HIGH SCHOOL FOR PROFESSIONAL CAREERS,144,364,379,371,371.3
14K477,SCHOOL FOR LEGAL STUDIES,134,413,396,395,401.3
14K478,"THE HIGH SCHOOL FOR ENTERPRISE, BUSINESS AND TECHNOLOGY",142,398,421,396,405.0
14K488,BROOKLYN PREPARATORY HIGH SCHOOL,42,367,373,350,363.3
14K558,WILLIAMSBURG HIGH SCHOOL FOR ARCHITECTURE AND DESIGN,72,363,385,364,370.7
14K561,WILLIAMSBURG PREPARATORY SCHOOL,113,397,410,380,395.7
14K586,LYONS COMMUNITY SCHOOL,31,371,377,355,367.7
14K610,AUTOMOTIVE HIGH SCHOOL,94,367,376,350,364.3
14K632,FRANCES PERKINS ACADEMY,12,382,372,368,374.0
14K685,EL PUENTE ACADEMY FOR PEACE AND JUSTICE,28,359,335,341,345.0
14K923,AUTOMOTIVE HIGH SCHOOL YABC,,,,,#DIV/0!
15K429,BROOKLYN SCHOOL FOR GLOBAL STUDIES,52,361,367,383,370.3
15K448,BROOKLYN SECONDARY SCHOOL FOR COLLABORATIVE STUDIES,76,393,399,387,393.0
15K462,SECONDARY SCHOOL FOR LAW,59,398,411,394,401.0
15K463,SECONDARY SCHOOL FOR JOURNALISM,58,397,391,381,389.7
15K464,PARK SLOPE COLLEGIATE,72,379,416,380,391.7
15K497,SCHOOL FOR INTERNATIONAL STUDIES,64,405,415,392,404.0
15K519,COBBLE HILL SCHOOL OF AMERICAN STUDIES,77,398,402,385,395.0
15K520,PACIFIC HIGH SCHOOL,9,352,341,300,331.0
15K529,WEST BROOKLYN COMMUNITY HIGH SCHOOL,,,,,#DIV/0!
15K530,METROPOLITAN CORPORATE ACADEMY HIGH SCHOOL,28,368,365,368,367.0
15K656,BROOKLYN HIGH SCHOOL OF THE ARTS,141,426,421,411,419.3
15K667,SUNSET PARK HIGH SCHOOL,,,,,#DIV/0!
15K698,SOUTH BROOKLYN COMMUNITY HIGH SCHOOL,8,430,416,425,423.7
16K393,FREDERICK DOUGLASS ACADEMY IV SECONDARY SCHOOL,20,355,355,358,356.0
16K455,BOYS AND GIRLS HIGH SCHOOL,131,365,370,362,365.7
16K498,BROOKLYN HIGH SCHOOL FOR LAW AND TECHNOLOGY,46,362,372,358,364.0
16K594,GOTHAM PROFESSIONAL ARTS ACADEMY,36,370,372,351,364.3
16K688,THE BROOKLYN ACADEMY OF GLOBAL FINANCE,,,,,#DIV/0!
17K382,ACADEMY FOR COLLEGE PREPARATION AND CAREER EXPLORATION: A COLLEGE BOARD SCHOOL,59,396,374,369,379.7
17K408,ACADEMY OF HOSPITALITY AND TOURISM,57,352,342,351,348.3
17K467,ERASMUS YABC,,,,,#DIV/0!
17K489,W.E.B. DUBOIS ACADEMIC HIGH SCHOOL,7,394,364,334,364.0
17K524,INTERNATIONAL HIGH SCHOOL AT PROSPECT HEIGHTS,71,287,335,291,304.3
17K528,THE HIGH SCHOOL FOR GLOBAL CITIZENSHIP,46,403,385,388,392.0
17K531,"SCHOOL FOR HUMAN RIGHTS, THE",35,348,381,359,362.7
17K533,SCHOOL FOR DEMOCRACY AND LEADERSHIP,38,377,404,372,384.3
17K537,HIGH SCHOOL FOR YOUTH AND COMMUNITY DEVELOPMENT AT ERASMUS,73,338,349,340,342.3
17K539,HIGH SCHOOL FOR SERVICE & LEARNING AT ERASMUS,61,362,375,368,368.3
17K543,"SCIENCE, TECHNOLOGY AND RESEARCH EARLY COLLEGE HIGH SCHOOL AT ERASMUS",69,457,462,441,453.3
17K544,INTERNATIONAL ARTS BUSINESS SCHOOL,54,386,391,369,382.0
17K546,HIGH SCHOOL FOR PUBLIC SERVICE: HEROES OF TOMORROW,79,418,441,414,424.3
17K547,BROOKLYN ACADEMY OF SCIENCE AND THE ENVIRONMENT,63,388,382,373,381.0
17K548,BROOKLYN SCHOOL FOR MUSIC & THEATRE,48,385,393,373,383.7
17K568,BROWNSVILLE ACADEMY HIGH SCHOOL,16,372,356,335,354.3
17K590,MEDGAR EVERS COLLEGE PREPARATORY SCHOOL,165,476,481,479,478.7
17K600,CLARA BARTON HIGH SCHOOL,259,425,413,413,417.0
17K625,PAUL ROBESON HIGH SCHOOL,53,365,363,355,361.0
17K751,ACADEMY FOR HEALTH CAREERS,,,,,#DIV/0!
18K563,IT TAKES A VILLAGE ACADEMY,56,313,320,330,321.0
18K566,BROOKLYN GENERATION SCHOOL,29,374,377,394,381.7
18K567,BROOKLYN THEATRE ARTS HIGH SCHOOL,54,383,358,377,372.7
18K569,KURT HAHN EXPEDITIONARY LEARNING SCHOOL,43,368,378,346,364.0
18K576,VICTORY COLLEGIATE HIGH SCHOOL,63,387,377,379,381.0
18K578,BROOKLYN BRIDGE ACADEMY,17,384,362,351,365.7
18K589,ARTS & MEDIA PREPARATORY ACADEMY,48,361,360,359,360.0
18K617,HIGH SCHOOL FOR INNOVATION IN ADVERTISING AND MEDIA,37,404,393,386,394.3
18K629,CULTURAL ACADEMY FOR THE ARTS AND SCIENCES,33,393,395,381,389.7
18K633,HIGH SCHOOL FOR MEDICAL PROFESSIONS,75,386,380,393,386.3
18K635,OLYMPUS ACADEMY,7,400,370,370,380.0
18K637,ACADEMY FOR CONSERVATION AND THE ENVIRONMENT,35,363,381,367,370.3
18K642,URBAN ACTION ACADEMY,40,376,385,374,378.3
18K673,EAST BROOKLYN COMMUNITY HIGH SCHOOL,12,410,403,378,397.0
19K409,EAST NEW YORK FAMILY ACADEMY,54,416,432,394,414.0
19K420,FRANKLIN K. LANE HIGH SCHOOL,,,,,#DIV/0!
19K431,THOMAS JEFFERSON YABC,,,,,#DIV/0!
19K502,FDNY HIGH SCHOOL FOR FIRE AND LIFE SAFETY,37,341,349,333,341.0
19K504,HIGH SCHOOL FOR CIVIL RIGHTS,47,363,349,342,351.3
19K507,PERFORMING ARTS AND TECHNOLOGY HIGH SCHOOL,61,380,386,383,383.0
19K510,WORLD ACADEMY FOR TOTAL COMMUNITY HEALTH HIGH SCHOOL,68,371,365,370,368.7
19K583,MULTICULTURAL HIGH SCHOOL,29,279,322,286,295.7
19K615,TRANSIT TECH CAREER AND TECHNICAL EDUCATION HIGH SCHOOL,182,395,418,380,397.7
19K618,ACADEMY OF INNOVATIVE TECHNOLOGY,60,371,371,354,365.3
19K639,BROOKLYN LAB SCHOOL,57,360,385,363,369.3
19K659,CYPRESS HILLS COLLEGIATE PREPARATORY SCHOOL,51,376,385,368,376.3
19K660,W. H. MAXWELL CAREER AND TECHNICAL EDUCATION HIGH SCHOOL,74,370,369,363,367.3
19K683,"THE SCHOOL FOR CLASSICS: AN ACADEMY OF THINKERS, WRITERS AND PERFORMERS",38,383,400,374,385.7
20K445,NEW UTRECHT HIGH SCHOOL,456,402,471,399,424.0
20K485,HIGH SCHOOL OF TELECOMMUNICATION ARTS AND TECHNOLOGY,238,425,474,424,441.0
20K490,FORT HAMILTON HIGH SCHOOL,694,417,478,411,435.3
20K505,FRANKLIN DELANO ROOSEVELT HIGH SCHOOL,385,383,486,375,414.7
20K609,THE URBAN ASSEMBLY SCHOOL FOR CRIMINAL JUSTICE,,,,,#DIV/0!
20K658,FRANKLIN DELANO ROOSEVELT YABC,18,338,477,316,377.0
21K337,INTERNATIONAL HIGH SCHOOL AT LAFAYETTE,54,326,386,314,342.0
21K344,RACHEL CARSON HIGH SCHOOL FOR COASTAL STUDIES,54,402,427,408,412.3
21K348,HIGH SCHOOL OF SPORTS MANAGEMENT,39,388,398,378,388.0
21K410,ABRAHAM LINCOLN HIGH SCHOOL,475,396,437,393,408.7
21K412/21K411,ABRAHAM LINCOLN YABC/LEARNING TO WORK GED AT ABRAHAM LINCOLN,,,,,#DIV/0!
21K468,KINGSBOROUGH EARLY COLLEGE SCHOOL,,,,,#DIV/0!
21K525,EDWARD R. MURROW HIGH SCHOOL,727,468,496,467,477.0
21K540,JOHN DEWEY HIGH SCHOOL,448,404,468,390,420.7
21K559,LIFE ACADEMY HIGH SCHOOL FOR FILM AND MUSIC,40,384,375,365,374.7
21K572,EXPEDITIONARY LEARNING SCHOOL FOR COMMUNITY LEADERS,40,353,370,356,359.7
21K620,WILLIAM E. GRADY CAREER AND TECHNICAL EDUCATION HIGH SCHOOL,95,394,414,376,394.7
21K690,BROOKLYN STUDIO SECONDARY SCHOOL,119,429,449,435,437.7
21K728,LIBERATION DIPLOMA PLUS,10,411,369,373,384.3
22K405,MIDWOOD HIGH SCHOOL,824,478,519,476,491.0
22K425,JAMES MADISON HIGH SCHOOL,518,436,475,439,450.0
22K495,SHEEPSHEAD BAY HIGH SCHOOL,236,383,392,370,381.7
22K535,LEON M. GOLDSTEIN HIGH SCHOOL FOR THE SCIENCES,259,524,561,542,542.3
22K555,BROOKLYN COLLEGE ACADEMY,131,456,456,440,450.7
23K493,BROOKLYN COLLEGIATE: A COLLEGE BOARD SCHOOL,60,389,409,387,395.0
23K514,FREDERICK DOUGLASS ACADEMY VII HIGH SCHOOL,55,361,371,359,363.7
23K643,BROOKLYN DEMOCRACY ACADEMY,11,349,338,331,339.3
23K646,ASPIRATIONS DIPLOMA PLUS HIGH SCHOOL,7,311,371,311,331.0
23K647,METROPOLITAN DIPLOMA PLUS HIGH SCHOOL,17,350,346,332,342.7
23K697,TEACHERS PREPARATORY HIGH SCHOOL,69,392,416,388,398.7
24Q264,ACADEMY OF FINANCE AND ENTERPRISE,89,405,454,421,426.7
24Q267,HIGH SCHOOL OF APPLIED COMMUNICATION,39,406,413,400,406.3
24Q293,CIVIC LEADERSHIP ACADEMY,69,404,429,407,413.3
24Q296,PAN AMERICAN INTERNATIONAL HIGH SCHOOL,55,317,323,311,317.0
24Q299,BARD HIGH SCHOOL EARLY COLLEGE II,155,545,568,550,554.3
24Q455,NEWTOWN HIGH SCHOOL,320,383,440,380,401.0
24Q457,YOUNG ADULT BOROUGH CENTER AT ARTS AND BUSINESS HS,,,,,#DIV/0!
24Q485,GROVER CLEVELAND HIGH SCHOOL,241,395,420,396,403.7
24Q520,MIDDLE COLLEGE HIGH SCHOOL AT LAGUARDIA COMMUNITY COLLEGE,58,399,393,385,392.3
24Q530,INTERNATIONAL HIGH SCHOOL AT LAGUARDIA COMMUNITY COLLEGE,69,326,409,329,354.7
24Q550,HIGH SCHOOL FOR ARTS AND BUSINESS,138,391,403,380,391.3
24Q560,"ROBERT F. WAGNER, JR. SECONDARY SCHOOL FOR ARTS AND TECHNOLOGY",80,443,447,440,443.3
24Q600,QUEENS VOCATIONAL AND TECHNICAL HIGH SCHOOL,155,417,447,406,423.3
24Q610,AVIATION CAREER & TECHNICAL EDUCATION HIGH SCHOOL,396,445,496,423,454.7
24Q744,VOYAGES PREPARATORY,,,,,#DIV/0!
25Q252,"QUEENS SCHOOL OF INQUIRY, THE",58,455,498,443,465.3
