25Q263,FLUSHING INTERNATIONAL HIGH SCHOOL,45,314,417,318,349.7
25Q281,EASTsWEST SCHOOL OF INTERNATIONAL STUDIES,59,416,463,392,423.7
25Q285,WORLD JOURNALISM PREPARATORY: A COLLEGE BOARD SCHOOL,63,471,489,481,480.3
25Q425,JOHN BOWNE HIGH SCHOOL,558,397,451,395,414.3
25Q460,FLUSHING HIGH SCHOOL,347,393,441,382,405.3
25Q467,FLUSHING YABC,9,378,373,344,365.0
25Q525,TOWNSEND HARRIS HIGH SCHOOL,278,621,651,638,636.7
25Q540,QUEENS ACADEMY HIGH SCHOOL,17,398,382,388,389.3
25Q670,ROBERT F. KENNEDY COMMUNITY HIGH SCHOOL,99,431,458,441,443.3
25Q792,NORTH QUEENS COMMUNITY HIGH SCHOOL,7,379,421,377,392.3
26Q415,BENJAMIN N. CARDOZO HIGH SCHOOL,888,480,545,489,504.7
26Q430,FRANCIS LEWIS HIGH SCHOOL,934,468,539,467,491.3
26Q435,MARTIN VAN BUREN HIGH SCHOOL,334,391,397,384,390.7
26Q495,BAYSIDE HIGH SCHOOL,708,462,523,464,483.0
26Q566,"QUEENS HIGH SCHOOL OF TEACHING, LIBERAL ARTS AND THE SCIENCES",175,425,434,420,426.3
27Q260,FREDERICK DOUGLASS ACADEMY VI HIGH SCHOOL,87,387,385,373,381.7
27Q262,CHANNEL VIEW SCHOOL FOR RESEARCH,74,432,419,401,417.3
27Q302,"QUEENS HIGH SCHOOL FOR INFORMATION, RESEARCH, AND TECHNOLOGY",44,391,401,364,385.3
27Q308,ROBERT H. GODDARD HIGH SCHOOL OF COMMUNICATION ARTS AND TECHNOLOGY,93,423,426,416,421.7
27Q309,ACADEMY OF MEDICAL TECHNOLOGY: A COLLEGE BOARD SCHOOL,36,367,379,348,364.7
27Q323,SCHOLARS' ACADEMY,89,499,537,496,510.7
27Q400,AUGUST MARTIN HIGH SCHOOL,101,377,371,360,369.3
27Q410,BEACH CHANNEL HIGH SCHOOL,78,384,396,354,378.0
27Q475,RICHMOND HILL HIGH SCHOOL,404,382,404,368,384.7
27Q480,JOHN ADAMS HIGH SCHOOL,403,391,409,392,397.3
27Q650,"HIGH SCHOOL FOR CONSTRUCTION TRADES, ENGINEERING AND ARCHITECTURE",194,429,491,425,448.3
28Q284,YORK EARLY COLLEGE ACADEMY,,,,,#DIV/0!
28Q310,QUEENS COLLEGIATE: A COLLEGE BOARD SCHOOL,68,420,445,400,421.7
28Q325,HILLSIDE ARTS & LETTERS ACADEMY,,,,,#DIV/0!
28Q338,QUEENS SATELLITE HIGH SCHOOL FOR OPPORTUNITY,6,403,408,367,392.7
28Q350,JAMAICA GATEWAY TO THE SCIENCES,25,430,452,425,435.7
28Q440,FOREST HILLS HIGH SCHOOL,762,456,497,454,469.0
28Q470,JAMAICA HIGH SCHOOL,90,342,368,353,354.3
28Q505,HILLCREST HIGH SCHOOL,462,395,413,386,398.0
28Q620,THOMAS A. EDISON CAREER AND TECHNICAL EDUCATION HIGH SCHOOL,422,452,478,442,457.3
28Q680,QUEENS GATEWAY TO HEALTH SCIENCES SECONDARY SCHOOL,99,513,523,502,512.7
28Q686,QUEENS METROPOLITAN HIGH SCHOOL,,,,,#DIV/0!
28Q687,QUEENS HIGH SCHOOL FOR THE SCIENCES AT YORK COLLEGE,121,612,660,596,622.7
28Q690,HIGH SCHOOL FOR LAW ENFORCEMENT AND PUBLIC SAFETY,74,406,406,384,398.7
28Q896,"YOUNG WOMEN'S LEADERSHIP SCHOOL, QUEENS",68,439,445,432,438.7
29Q248,QUEENS PREPARATORY ACADEMY,52,360,380,359,366.3
29Q259,PATHWAYS COLLEGE PREPARATORY SCHOOL: A COLLEGE BOARD SCHOOL,46,401,397,375,391.0
29Q265,EXCELSIOR PREPARATORY HIGH SCHOOL,49,402,398,402,400.7
29Q272,GEORGE WASHINGTON CARVER HIGH SCHOOL FOR THE SCIENCES,59,436,427,424,429.0
29Q283,PREPARATORY ACADEMY FOR WRITERS: A COLLEGE BOARD SCHOOL,43,370,367,363,366.7
29Q326,CAMBRIA HEIGHTS ACADEMY,,,,,#DIV/0!
29Q492,"MATHEMATICS, SCIENCE RESEARCH AND TECHNOLOGY MAGNET HIGH SCHOOL",78,400,426,394,406.7
29Q494,"LAW, GOVERNMENT AND COMMUNITY SERVICE HIGH SCHOOL",52,385,377,377,379.7
29Q496,"BUSINESS, COMPUTER APPLICATIONS & ENTREPRENEURSHIP HIGH SCHOOL",49,379,414,359,384.0
29Q498,HUMANITIES & ARTS MAGNET HIGH SCHOOL,62,393,381,377,383.7
30Q286,"YOUNG WOMEN'S LEADERSHIP SCHOOL, ASTORIA",,,,,#DIV/0!
30Q301,ACADEMY FOR CAREERS IN TELEVISION AND FILM,98,410,440,405,418.3
30Q445,WILLIAM CULLEN BRYANT HIGH SCHOOL,395,414,449,412,425.0
30Q450,LONG ISLAND CITY HIGH SCHOOL,392,403,420,395,406.0
30Q501,FRANK SINATRA SCHOOL OF THE ARTS HIGH SCHOOL,174,504,496,494,498.0
30Q502,INFORMATION TECHNOLOGY HIGH SCHOOL,148,407,434,398,413.0
30Q555,NEWCOMERS HIGH SCHOOL,143,323,475,329,375.7
30Q575,ACADEMY OF AMERICAN STUDIES,135,487,492,491,490.0
30Q580,BACCALAUREATE SCHOOL FOR GLOBAL EDUCATION,61,524,568,544,545.3
31R047,CSI HIGH SCHOOL FOR INTERNATIONAL STUDIES,137,452,451,450,451.0
31R064,GAYNOR MCCOWN EXPEDITIONARY LEARNING SCHOOL,61,398,412,385,398.3
31R080,THE MICHAEL J. PETRIDES SCHOOL,107,472,488,466,475.3
31R440,NEW DORP HIGH SCHOOL,391,424,437,416,425.7
31R445,PORT RICHMOND HIGH SCHOOL,271,424,438,417,426.3
31R450,CURTIS HIGH SCHOOL,375,437,435,429,433.7
31R455,TOTTENVILLE HIGH SCHOOL,807,462,486,470,472.7
31R460,SUSAN E. WAGNER HIGH SCHOOL,535,455,474,459,462.7
31R470,CONCORD HIGH SCHOOL,10,466,455,414,445.0
31R600,RALPH R. MCKEE CAREER AND TECHNICAL EDUCATION HIGH SCHOOL,94,416,422,397,411.7
31R605,STATEN ISLAND TECHNICAL HIGH SCHOOL,227,635,682,636,651.0
31R607,YOUNG ADULT BOROUGH CENTER AT STATEN IS TECH HS,10,405,375,370,383.3
32K403,ACADEMY FOR ENVIRONMENTAL LEADERSHIP,50,380,366,352,366.0
32K545,EBC HIGH SCHOOL FOR PUBLIC SERVICE‰ÛÒBUSHWICK,88,384,409,361,384.7
32K549,BUSHWICK SCHOOL FOR SOCIAL JUSTICE,75,348,353,334,345.0
32K552,ACADEMY OF URBAN PLANNING,67,342,364,354,353.3
32K554,ALL CITY LEADERSHIP SECONDARY SCHOOL,39,428,465,422,438.3
32K556,BUSHWICK LEADERS HIGH SCHOOL FOR ACADEMIC EXCELLENCE,23,347,358,350,351.7
32K564,BUSHWICK COMMUNITY HIGH SCHOOL,24,359,317,358,344.7
75K371,P.S. 371 s LILLIAN L. RASHKIS,,,,,#DIV/0!
75M035,P.S. 035,,,,,#DIV/0!
75Q256,P.S. Q256,,,,,#DIV/0!
75Q811,P.S. Q811,32,429,444,433,435.3
75R025,SOUTH RICHMOND HIGH SCHOOL I.S./P.S. 25,,,,,#DIV/0!
75X012,P.S. X012 LEWIS AND CLARK SCHOOL,,,,,#DIV/0!
75X754,J. M. RAPPORT SCHOOL CAREER DEVELOPMENT,,,,,#DIV/0!
79M645,SCHOOL FOR COOPERATIVE TECHNICAL EDUCATION,,,,,#DIV/0!
79Q950,GED PLUS s CITYWIDE,8,496,400,426,440.7
79X490,PHOENIX ACADEMY,9,367,370,360,365.7